{
  "schemaVersion": 3,
  "runtime": {
    "type": "hermes",
    "providerKey": "hermes-core",
    "contractVersion": 1,
    "nativeVersion": "v2026.8.27",
    "bridgeVersion": null,
    "imageRef": "nousresearch/hermes-agent:v2026.8.27",
    "artifactIdentity": {
      "kind": "oci-digest",
      "value": "sha256:e0df6adebddf29b91112aefc999d4aaf6846c9eb544faca5672a16a13590ff79"
    }
  },
  "environments": [
    {
      "id": "windows-docker-desktop-20260902",
      "platform": "windows",
      "platformVersion": null,
      "architecture": null,
      "containerEngine": "docker-desktop",
      "containerEngineVersion": null,
      "runtimeVersion": "v2026.8.27 (upgrade/rollback checks also used v2026.8.31)",
      "mybayVersion": "0.1.26",
      "headless": false
    },
    {
      "id": "windows-docker-desktop-20260908",
      "platform": "windows",
      "platformVersion": "Windows 10 Pro",
      "architecture": "x64",
      "containerEngine": "docker-desktop",
      "containerEngineVersion": "29.7.2",
      "runtimeVersion": "v2026.8.27 (upgrade/rollback checks also used v2026.8.31)",
      "mybayVersion": "0.1.27",
      "headless": false
    },
    {
      "id": "windows-docker-desktop-v0128-hermes-20260908",
      "platform": "windows",
      "platformVersion": "Windows 10 Pro",
      "architecture": "x64",
      "containerEngine": "docker-desktop",
      "containerEngineVersion": "29.7.2",
      "runtimeVersion": "v2026.8.27",
      "mybayVersion": "0.1.28",
      "headless": false
    },
    {
      "id": "windows-docker-desktop-p03-hermes-20260910",
      "platform": "windows",
      "platformVersion": "Windows 10 Pro",
      "architecture": "x64",
      "containerEngine": "docker-desktop",
      "containerEngineVersion": "29.7.2",
      "runtimeVersion": "Hermes v2026.8.27",
      "mybayVersion": "0.1.28",
      "headless": false
    },
    {
      "id": "windows-docker-desktop-v0129-preview1-hermes-20260910",
      "platform": "windows",
      "platformVersion": "Windows 10 Pro",
      "architecture": "x64",
      "containerEngine": "docker-desktop",
      "containerEngineVersion": "29.7.2",
      "runtimeVersion": "Hermes v2026.8.27",
      "mybayVersion": "0.1.29-preview.1",
      "headless": true
    },
    {
      "id": "windows-docker-desktop-v0129-hermes-release-20260911",
      "platform": "windows",
      "platformVersion": "Windows 10 Pro",
      "architecture": "x64",
      "containerEngine": "docker-desktop",
      "containerEngineVersion": "29.7.2",
      "runtimeVersion": "Hermes v2026.8.27",
      "mybayVersion": "0.1.29",
      "headless": true
    },
    {
      "id": "windows-docker-desktop-v01291-hermes-release-20260913",
      "platform": "windows",
      "platformVersion": "Windows 10 Pro",
      "architecture": "x64",
      "containerEngine": "docker-desktop",
      "containerEngineVersion": "29.7.2",
      "runtimeVersion": "Hermes v2026.8.27",
      "mybayVersion": "0.1.29.1",
      "headless": true
    }
  ],
  "artifacts": [
    {
      "path": "certification/artifacts/hermes-beta-core-20260902.json",
      "sha256": "2296b94744a5401c0170c8b30e04ddb7cc08e1f90c3391a5760942a8149e88df"
    },
    {
      "path": "certification/artifacts/hermes-certified-backup-restore-20260903.json",
      "sha256": "e9d9b9e8334eda82f1122bd6c9cdb9173c01c242c770344314e6185dfa7a72a8"
    },
    {
      "path": "certification/artifacts/hermes-certified-control-plane-deploy-20260902.json",
      "sha256": "9d91a5fa4aef4677f81e9ca5d3ea57a14c22db3b2095fec8acaac338cf2f1001"
    },
    {
      "path": "certification/artifacts/hermes-certified-real-e2e-20260903.json",
      "sha256": "af4c4a207dd9f7471f1f69cf225c585421e34af23cc5c842fcbd31e770ca0df7"
    },
    {
      "path": "certification/artifacts/hermes-certified-security-20260903.json",
      "sha256": "77f4d9fc8e5ffd879983a3707539dc3ade0ca9c8880231da1f32a0be0112ba8c"
    },
    {
      "path": "certification/artifacts/hermes-certified-upgrade-rollback-20260903.json",
      "sha256": "6cd891eac87484cdb1d69ba73b922993e81f6d758c6c3543182d3253a931f73b"
    },
    {
      "path": "certification/artifacts/hermes-experimental-20260902.json",
      "sha256": "82f0a7744dab39830bf7e4d802807367314f874431a339143f2b36a18ec21000"
    },
    {
      "path": "certification/artifacts/hermes-v0127-foundation-20260908.json",
      "sha256": "76e7ecf40c19324ed35da890b54f09da1c33c05579dcbce7337ea95718ccadbb"
    },
    {
      "path": "certification/artifacts/hermes-v0127-beta-security-20260908.json",
      "sha256": "19e7f7eda20eea49133b73b924445aefddb7273dc00ee34e6bddcf9afa1f11a7"
    },
    {
      "path": "certification/artifacts/hermes-v0127-certified-lifecycle-20260908.json",
      "sha256": "18d984d81e5bd73fec5c1ff02657e6e8a31154647f8775a1c319e646c14fe345"
    },
    {
      "path": "certification/artifacts/runtime-v0128-streaming-smoke-20260908.json",
      "sha256": "59da8abd22eb8849ae3663e4e86570a8bff6c41fa1f1002de49a5d45d7777892"
    },
    {
      "path": "certification/artifacts/runtime-defaults-p02-windows-x64-20260910.json",
      "sha256": "fdbf08bc8f84567191caae1cdc82c4d9b4d4c049c8ce76aa878468cf75f5d9cd"
    },
    {
      "path": "certification/artifacts/runtime-hardening-p03-windows-x64-20260910.json",
      "sha256": "33aff47f243fdf1d3e84a3ef89e9065bea4abaaf9b3f2a42794068b1b62c7429"
    },
    {
      "path": "certification/artifacts/runtime-v0129-preview1-candidate-20260910.json",
      "sha256": "47bb9ae9ebd31770bcad1208d9405b74d4678355e1f0fe76fbb6e60ca9c4511d"
    },
    {
      "path": "certification/artifacts/runtime-v0129-release-promotion-windows-x64-20260911.json",
      "sha256": "9a33fc6b0485015617e47b3c7d1df5ec894a07c0f3895a6e75a3bb90906356f2"
    },
    {
      "path": "certification/artifacts/runtime-v01291-release-promotion-windows-x64-20260913.json",
      "sha256": "9914fcd81bd57b99e40032e2c0461528b71d486f4faba3c7ab2cd67a2d5769c7"
    }
  ],
  "checks": [
    {
      "requirementId": "runtime-install",
      "status": "passed",
      "scope": "runtime",
      "observedAt": "2026-09-07T16:48:15.993Z",
      "environment": "Windows 10 Pro x64 + Docker Desktop 29.7.2; MyBay OSS 0.1.27 isolated production build; Hermes v2026.8.27 with upgrade/rollback through v2026.8.31; credentialed browser acceptance",
      "evidenceRefs": [
        "certification/artifacts/hermes-v0127-foundation-20260908.json#observations.runtimeInstall"
      ],
      "note": "The isolated MyBay 0.1.27 production build managed the official Hermes v2026.8.27 image in a healthy, sendable, loopback-bound Runtime container."
    },
    {
      "requirementId": "task-submit",
      "status": "passed",
      "scope": "runtime",
      "observedAt": "2026-09-07T16:45:38.260Z",
      "environment": "Windows 10 Pro x64 + Docker Desktop 29.7.2; MyBay OSS 0.1.27 isolated production build; Hermes v2026.8.27 with upgrade/rollback through v2026.8.31; credentialed browser acceptance",
      "evidenceRefs": [
        "certification/artifacts/hermes-v0127-foundation-20260908.json#observations.taskSubmit"
      ],
      "note": "An authenticated browser task produced persisted MyBay and upstream Hermes run identities and reached completed."
    },
    {
      "requirementId": "streaming-output",
      "status": "passed",
      "scope": "runtime",
      "observedAt": "2026-09-07T19:12:40.573Z",
      "environment": "Windows 10 Pro x64 + Docker Desktop 29.7.2; MyBay OSS 0.1.28 isolated production build; Hermes v2026.8.27; credentialed browser acceptance",
      "evidenceRefs": [
        "certification/artifacts/hermes-v0127-foundation-20260908.json#observations.streamingOutput",
        "certification/artifacts/runtime-v0128-streaming-smoke-20260908.json#observations.hermesStreaming"
      ],
      "note": "Hermes completed the authenticated MyBay 0.1.28 browser streaming path with an exact marker, terminal persistence, and provider-reported usage."
    },
    {
      "requirementId": "cancellation",
      "status": "passed",
      "scope": "runtime",
      "observedAt": "2026-09-07T13:00:31.953Z",
      "environment": "Windows 10 Pro x64 + Docker Desktop 29.7.2; MyBay OSS 0.1.27 isolated production build; Hermes v2026.8.27 with upgrade/rollback through v2026.8.31; credentialed browser acceptance",
      "evidenceRefs": [
        "certification/artifacts/hermes-v0127-certified-lifecycle-20260908.json#observations.cancellation"
      ],
      "note": "A running task persisted cancelled/CANCELLED_UPSTREAM after stop, and the immediately following task completed with its expected marker."
    },
    {
      "requirementId": "session-recovery",
      "status": "passed",
      "scope": "runtime",
      "observedAt": "2026-09-07T16:59:18.027Z",
      "environment": "Windows 10 Pro x64 + Docker Desktop 29.7.2; MyBay OSS 0.1.27 isolated production build; Hermes v2026.8.27 with upgrade/rollback through v2026.8.31; credentialed browser acceptance",
      "evidenceRefs": [
        "certification/artifacts/hermes-v0127-beta-security-20260908.json#observations.sessionRecovery"
      ],
      "note": "The authenticated browser reused the original conversation after Runtime restart and recovered the retained facts through the MyBay history bridge."
    },
    {
      "requirementId": "file-artifact",
      "status": "passed",
      "scope": "runtime",
      "observedAt": "2026-09-07T16:59:18.027Z",
      "environment": "Windows 10 Pro x64 + Docker Desktop 29.7.2; MyBay OSS 0.1.27 isolated production build; Hermes v2026.8.27 with upgrade/rollback through v2026.8.31; credentialed browser acceptance",
      "evidenceRefs": [
        "certification/artifacts/hermes-v0127-beta-security-20260908.json#observations.fileArtifact"
      ],
      "note": "A Runtime-created UTF-8 artifact retained its exact size and SHA-256 and remained previewable in the browser before and after reload and restart."
    },
    {
      "requirementId": "usage-reporting",
      "status": "passed",
      "scope": "runtime",